{
  "schema_version": 1,
  "id": "example-workspace",
  "name": "Środowisko projektu przykładowego",
  "kind": "project",
  "source": {
    "machine": "nvidia",
    "path": "/home/tom/github/organizacja/projekt",
    "access": "read-only"
  },
  "copy": {
    "mode": "full-selected-directory",
    "storage_key": "example-workspace",
    "container_path": "/home/tom/github/organizacja/projekt",
    "preserve_paths": true,
    "on_conflict": "stop"
  },
  "environment": {
    "image_digest": null,
    "requirements": [
      {
        "tool": "python",
        "exact_version": null,
        "source_path": null
      },
      {
        "tool": "node",
        "exact_version": null,
        "source_path": null
      }
    ],
    "profiles": [],
    "verification": "pending"
  },
  "project_refs": [
    "example-project"
  ],
  "provisioning": "planned"
}
